{
 "schema_version": "1.1.0",
 "generated_at": "2026-10-15T05:30:24Z",
 "periods": [
  "1999",
  "2000",
  "2001",
  "2002",
  "2003",
  "2004",
  "2005",
  "2006",
  "2007",
  "2008",
  "2009",
  "2010",
  "2011",
  "2012",
  "2013",
  "2014",
  "2015",
  "2016",
  "2017",
  "2018",
  "2019",
  "2020",
  "2021",
  "2022",
  "2023",
  "2024"
 ],
 "dimensions": [
  {
   "id": "road_user",
   "label": "Road user",
   "description": "Persons killed by their role in the crash.",
   "unit": "persons",
   "source_id": "eurostat:tran_sf_roadus",
   "source_url": "https://ec.europa.eu/eurostat/databrowser/view/tran_sf_roadus/default/table",
   "source_published_at": "2026-08-25T21:00:00Z",
   "retrieved_at": "2026-10-15T05:30:25Z",
   "categories": [
    {
     "id": "DRIV",
     "label": "Drivers and riders",
     "description": "Drivers of motor vehicles and riders of motorcycles, mopeds and bicycles.",
     "source_categories": [
      "DRIV"
     ]
    },
    {
     "id": "PAS",
     "label": "Passengers",
     "description": "Passengers of any vehicle.",
     "source_categories": [
      "PAS"
     ]
    },
    {
     "id": "PED",
     "label": "Pedestrians",
     "description": "People on foot.",
     "source_categories": [
      "PED"
     ]
    },
    {
     "id": "UNK",
     "label": "Unknown",
     "description": "Role not recorded.",
     "source_categories": [
      "UNK"
     ]
    }
   ],
   "eu_members_reporting": [
    15,
    18,
    19,
    19,
    20,
    21,
    24,
    24,
    25,
    26,
    26,
    26,
    24,
    24,
    25,
    25,
    26,
    27,
    27,
    27,
    27,
    27,
    27,
    27,
    27,
    27
   ]
  },
  {
   "id": "vehicle",
   "label": "Mode of transport",
   "description": "Persons killed by the vehicle they were using (pedestrians: none).",
   "unit": "persons",
   "source_id": "eurostat:tran_sf_roadve",
   "source_url": "https://ec.europa.eu/eurostat/databrowser/view/tran_sf_roadve/default/table",
   "source_published_at": "2026-08-25T21:00:00Z",
   "retrieved_at": "2026-10-15T05:30:26Z",
   "categories": [
    {
     "id": "CAR",
     "label": "Car occupants",
     "description": "Drivers and passengers of passenger cars.",
     "source_categories": [
      "CAR"
     ]
    },
    {
     "id": "MOTO",
     "label": "Motorcyclists",
     "description": "Riders and passengers of motorcycles of any engine size.",
     "source_categories": [
      "MOTO_LE125",
      "MOTO_GT125",
      "MOTO_NSP",
      "MOTO_2WH"
     ]
    },
    {
     "id": "MOP",
     "label": "Moped riders",
     "description": "Riders and passengers of mopeds.",
     "source_categories": [
      "MOP"
     ]
    },
    {
     "id": "CYCLE",
     "label": "Cyclists",
     "description": "Riders of bicycles, including electrically assisted bicycles (e-bikes).",
     "source_categories": [
      "BIKE",
      "EPAC"
     ]
    },
    {
     "id": "GOODS",
     "label": "Goods vehicles and tractors",
     "description": "Occupants of vans, lorries, road tractors and agricultural tractors.",
     "source_categories": [
      "VEH_GD",
      "VG_LE3P5",
      "VG_GT3P5",
      "TRC",
      "TRC_AGR"
     ]
    },
    {
     "id": "BUS",
     "label": "Buses and coaches",
     "description": "Occupants of buses, mini-buses, trolley buses and motor coaches.",
     "source_categories": [
      "BUS_TOT",
      "BUS_MIN",
      "BUS",
      "BUS_TRO",
      "MCO"
     ]
    },
    {
     "id": "PED",
     "label": "Pedestrians",
     "description": "People not using a vehicle (Eurostat category 'Other').",
     "source_categories": [
      "OTH"
     ]
    },
    {
     "id": "OTHER",
     "label": "Other and unknown",
     "description": "Quads, e-scooters and other micro-mobility, trams, other vehicles, riding animals, and unknown.",
     "source_categories": [
      "QUA_LE50",
      "QUA_GT50",
      "MCMOB",
      "MTZ_OTH",
      "NMTZ_OTH",
      "ANI_RD",
      "TRM_LR",
      "UNK"
     ]
    }
   ],
   "eu_members_reporting": [
    15,
    18,
    19,
    19,
    20,
    21,
    24,
    24,
    25,
    26,
    26,
    26,
    24,
    24,
    25,
    25,
    26,
    27,
    27,
    27,
    27,
    27,
    27,
    27,
    27,
    27
   ]
  }
 ],
 "series": [
{"geo":"EU27_2020","dimension":"road_user","category":"DRIV","values":[21071,28887,28278,27403,27044,25236,24565,23100,23431,21907,20001,17916,17333,16126,14638,14775,15092,14874,14803,14939,14561,12485,13325,13824,13582,13512],"statuses":["unknown","unknown","unknown","unknown","unknown","unknown","unknown","unknown","unknown","unknown","unknown","unknown","unknown","unknown","unknown","unknown","unknown","unknown","unknown","unknown","unknown","unknown","unknown","unknown","unknown","unknown"]},
{"geo":"EU27_2020","dimension":"road_user","category":"PAS","values":[7647,10504,10135,9785,9322,8626,8186,7485,7286,7039,6221,5500,4978,4401,4092,3893,3995,3911,3673,3538,3461,2685,2949,3078,3099,2878],"statuses":["unknown","unknown","unknown","unknown","unknown","unknown","unknown","unknown","unknown","unknown","unknown","unknown","unknown","unknown","unknown","unknown","unknown","unknown","unknown","unknown","unknown","unknown","unknown","unknown","unknown","unknown"]},
{"geo":"EU27_2020","dimension":"road_user","category":"PED","values":[5774,8977,8471,8631,7857,8060,7521,7409,7618,7478,6417,5853,5766,5229,5199,5142,4910,4957,4854,4757,4625,3602,3574,3747,3688,3537],"statuses":["unknown","unknown","unknown","unknown","unknown","unknown","unknown","unknown","unknown","unknown","unknown","unknown","unknown","unknown","unknown","unknown","unknown","unknown","unknown","unknown","unknown","unknown","unknown","unknown","unknown","unknown"]},
{"geo":"EU27_2020","dimension":"road_user","category":"UNK","values":[20265,5114,4476,4606,3182,2605,2335,2426,1756,508,383,342,671,744,297,326,361,66,62,93,110,58,68,5,17,6],"statuses":["unknown","unknown","unknown","unknown","unknown","unknown","unknown","unknown","unknown","unknown","unknown","unknown","unknown","unknown","unknown","unknown","unknown","unknown","unknown","unknown","unknown","unknown","unknown","unknown","unknown","unknown"]},
{"geo":"BE","dimension":"road_user","category":"DRIV","values":[1006,1068,1054,962,930,906,808,805,834,692,701,577,627,560,523,530,563,492,437,456,471,378,381,413,372,351],"statuses":["unknown","unknown","unknown","unknown","unknown","unknown","unknown","unknown","unknown","unknown","unknown","unknown","unknown","unknown","unknown","unknown","unknown","unknown","unknown","unknown","unknown","unknown","unknown","unknown","unknown","unknown"]},
{"geo":"BE","dimension":"road_user","category":"PAS","values":[237,259,274,216,170,155,173,141,132,151,140,132,123,101,113,97,97,90,74,73,79,55,53,43,48,47],"statuses":["unknown","unknown","unknown","unknown","unknown","unknown","unknown","unknown","unknown","unknown","unknown","unknown","unknown","unknown","unknown","unknown","unknown","unknown","unknown","unknown","unknown","unknown","unknown","unknown","unknown","unknown"]},
{"geo":"BE","dimension":"road_user","category":"PED","values":[154,142,158,127,113,101,108,122,104,99,101,108,115,117,109,107,94,81,95,74,92,65,75,83,77,70],"statuses":["unknown","unknown","unknown","unknown","unknown","unknown","unknown","unknown","unknown","unknown","unknown","unknown","unknown","unknown","unknown","unknown","unknown","unknown","unknown","unknown","unknown","unknown","unknown","unknown","unknown","unknown"]},
{"geo":"BE","dimension":"road_user","category":"UNK","values":[0,1,0,1,0,0,0,1,1,2,2,33,19,49,19,11,8,7,3,1,4,1,7,1,4,2],"statuses":["unknown","unknown","unknown","unknown","unknown","unknown","unknown","unknown","unknown","unknown","unknown","unknown","unknown","unknown","unknown","unknown","unknown","unknown","unknown","unknown","unknown","unknown","unknown","unknown","unknown","unknown"]},
{"geo":"BG","dimension":"road_user","category":"DRIV","values":[null,null,null,null,null,null,null,null,null,475,436,361,308,297,329,326,346,395,341,315,332,250,295,291,282,273],"statuses":["missing","missing","missing","missing","missing","missing","missing","missing","missing","unknown","unknown","unknown","unknown","unknown","unknown","unknown","unknown","unknown","unknown","unknown","unknown","unknown","unknown","unknown","unknown","unknown"]},
{"geo":"BG","dimension":"road_user","category":"PAS","values":[null,null,null,null,null,null,null,null,null,308,267,239,199,168,163,178,197,190,183,172,142,116,170,146,146,94],"statuses":["missing","missing","missing","missing","missing","missing","missing","missing","missing","unknown","unknown","unknown","unknown","unknown","unknown","unknown","unknown","unknown","unknown","unknown","unknown","unknown","unknown","unknown","unknown","unknown"]},
{"geo":"BG","dimension":"road_user","category":"PED","values":[null,null,null,null,null,null,null,null,null,278,198,174,149,135,108,156,164,118,157,123,154,94,94,94,97,111],"statuses":["missing","missing","missing","missing","missing","missing","missing","missing","missing","unknown","unknown","unknown","unknown","unknown","unknown","unknown","unknown","unknown","unknown","unknown","unknown","unknown","unknown","unknown","unknown","unknown"]},
{"geo":"BG","dimension":"road_user","category":"UNK","values":[1047,1012,1011,959,960,943,957,1043,1006,0,0,2,0,1,1,1,1,5,1,0,0,3,2,0,0,0],"statuses":["unknown","unknown","unknown","unknown","unknown","unknown","unknown","unknown","unknown","unknown","unknown","unknown","unknown","unknown","unknown","unknown","unknown","unknown","unknown","unknown","unknown","unknown","unknown","unknown","unknown","unknown"]},